{"config_sha256":"dddddddddddddddddddddddddddddddddddddddddddddddddddddddddddddddd","coverage":{"holds_and_catalog":{"fence_revision":"fence-r1","record_count":0,"record_set_sha256":"4f53cda18c2baa0c0354bb5f9a3ecbe5ed12ab4d8e11ba873c2f11161202b945","snapshot_revision":"snapshot-r1","source_id":"synthetic-holds_and_catalog"},"inflight_and_unknown_writes":{"fence_revision":"fence-r1","record_count":0,"record_set_sha256":"4f53cda18c2baa0c0354bb5f9a3ecbe5ed12ab4d8e11ba873c2f11161202b945","snapshot_revision":"snapshot-r1","source_id":"synthetic-inflight_and_unknown_writes"},"restore_and_prune":{"fence_revision":"fence-r1","record_count":0,"record_set_sha256":"4f53cda18c2baa0c0354bb5f9a3ecbe5ed12ab4d8e11ba873c2f11161202b945","snapshot_revision":"snapshot-r1","source_id":"synthetic-restore_and_prune"},"retained_artifacts":{"fence_revision":"fence-r1","record_count":0,"record_set_sha256":"4f53cda18c2baa0c0354bb5f9a3ecbe5ed12ab4d8e11ba873c2f11161202b945","snapshot_revision":"snapshot-r1","source_id":"synthetic-retained_artifacts"}},"installation_id":"installation_synthetic","observed_at":"2026-10-29T00:00:00Z","references":[],"references_sha256":"4f53cda18c2baa0c0354bb5f9a3ecbe5ed12ab4d8e11ba873c2f11161202b945","schema_version":"public-c-backup-kek-retained-input.v1","source_revision":"scan-r1","valid_until":"2026-10-29T00:05:00Z"}